{
  "id": "W2006",
  "hero": {
    "judul": {
      "id": "drg. Susana S. Sp. Pros — Surabaya",
      "en": "drg. Susana S. Sp. Pros — Surabaya"
    },
    "sub": {
      "id": "Siapkan kunjungan dengan informasi lokasi dan kontak klinik. Disusun 28 Oktober 2026.",
      "en": "Plan your visit with the clinic location and contact information. Prepared 28 October 2026."
    },
    "cta": {
      "id": "Lihat kontak praktik",
      "en": "View practice contact"
    }
  },
  "layanan": [
    {
      "nama": {
        "id": "Tanya jadwal",
        "en": "Ask about hours"
      },
      "ringkas": {
        "id": "Siapkan pilihan hari dan tanyakan jadwal sebelum datang.",
        "en": "Choose a preferred day and ask about visiting hours before coming."
      }
    },
    {
      "nama": {
        "id": "Panduan lokasi",
        "en": "Location guide"
      },
      "ringkas": {
        "id": "Periksa alamat praktik untuk merencanakan perjalanan.",
        "en": "Check the practice address to plan your journey."
      }
    },
    {
      "nama": {
        "id": "Tanya perawatan",
        "en": "Treatment enquiries"
      },
      "ringkas": {
        "id": "Tanyakan ketersediaan tindakan yang Anda perlukan.",
        "en": "Ask whether the treatment you need is available."
      }
    },
    {
      "nama": {
        "id": "Tanya biaya",
        "en": "Cost enquiries"
      },
      "ringkas": {
        "id": "Minta rincian biaya sebelum menyetujui pemeriksaan atau tindakan.",
        "en": "Request a cost breakdown before agreeing to an examination or treatment."
      }
    }
  ],
  "fitur_khas": {
    "judul": {
      "id": "Persiapan kunjungan",
      "en": "Plan your visit"
    },
    "penjelasan": {
      "id": "Pilih hal yang ingin ditanyakan, lalu susun pertanyaan jadwal, lokasi, dan biaya sebelum berkunjung.",
      "en": "Choose what you want to ask and prepare questions about hours, location and costs before visiting."
    },
    "alasan_dipilih": "Informasi jadwal dan kontak tersebar pada sumber publik; panduan membantu pasien menyiapkan pertanyaan tanpa menganggap jadwal atau perawatan tersedia."
  },
  "faq": [
    {
      "q": {
        "id": "Di mana lokasi praktik?",
        "en": "Where is the practice?"
      },
      "a": {
        "id": "Jl. Kahuripan No.4, Keputran, Tegalsari, Kota Surabaya, Jawa Timur 60265. Periksa arah perjalanan sebelum datang.",
        "en": "Jl. Kahuripan No.4, Keputran, Tegalsari, Kota Surabaya, Jawa Timur 60265. Check your route before visiting."
      }
    },
    {
      "q": {
        "id": "Kapan jam kunjungan?",
        "en": "When can I visit?"
      },
      "a": {
        "id": "Jam kunjungan belum dapat dipastikan. Hubungi klinik sebelum berangkat.",
        "en": "Visiting hours have not been confirmed. Contact the clinic before travelling."
      }
    },
    {
      "q": {
        "id": "Bagaimana menghubungi praktik?",
        "en": "How can I contact the practice?"
      },
      "a": {
        "id": "Kontak publik yang tercantum: +6281703000735. Nomor ponsel dianggap sebagai WA; status aktif belum diuji.",
        "en": "The listed public contact is +6281703000735. This mobile number is treated as WhatsApp; its active status has not been tested."
      }
    },
    {
      "q": {
        "id": "Berapa biaya kunjungan?",
        "en": "What does a visit cost?"
      },
      "a": {
        "id": "Tarif resmi belum tersedia pada halaman ini. Tanyakan rincian biaya kepada praktik sebelum kunjungan.",
        "en": "Official fees are not available on this page. Ask the practice for a cost breakdown before visiting."
      }
    },
    {
      "q": {
        "id": "Apakah menerima asuransi?",
        "en": "Is insurance accepted?"
      },
      "a": {
        "id": "Informasi asuransi belum terverifikasi. Periksa ketentuan dengan praktik dan penyedia asuransi Anda.",
        "en": "Insurance arrangements have not been verified. Check with the practice and your insurer."
      }
    },
    {
      "q": {
        "id": "Apakah perlu membuat janji?",
        "en": "Do I need an appointment?"
      },
      "a": {
        "id": "Tanyakan ketentuan pendaftaran dan ketersediaan dokter melalui kontak klinik.",
        "en": "Contact the clinic to check registration arrangements and doctor availability."
      }
    }
  ],
  "cta": {
    "id": "Hubungi klinik untuk informasi kunjungan",
    "en": "Contact the clinic for visiting information"
  },
  "pesan_wa_default": "Halo drg. Susana S. Sp. Pros, saya ingin menanyakan jadwal kunjungan dan ketersediaan perawatan. Terima kasih.",
  "outreach": {
    "wa": "Selamat pagi, manajemen drg. Susana S. Sp. Pros. Saya Muhammad Rizqi Tri Andika dari Maxi Growth Studio. Kami melihat lokasi klinik di Jl. Kahuripan 4. Kami sudah membuat konsep website untuk ditinjau di https://maxigrowthstudio.com/drg-susana. Jika berkenan, mohon masukan atas informasi klinik. Terima kasih. WA 082141004400; info@maxigrowthstudio.com.",
    "email_subjek": "Konsep website drg. Susana S. Sp. Pros",
    "email_isi": "Yth. Manajemen drg. Susana S. Sp. Pros,\n\nSaya Muhammad Rizqi Tri Andika dari Maxi Growth Studio. Lokasi klinik di Jl. Kahuripan 4 tercantum pada sumber publik. Kami sudah membuat konsep website untuk membantu pengunjung menemukan lokasi dan informasi kunjungan: https://maxigrowthstudio.com/drg-susana.\n\nProposal PDF terlampir untuk ditinjau. Informasi yang belum terverifikasi dapat dilengkapi berdasarkan keterangan manajemen. Kami terbuka atas masukan mengenai konsep tersebut.\n\nTerima kasih,\nMuhammad Rizqi Tri Andika\nMaxi Growth Studio\nWA 082141004400\ninfo@maxigrowthstudio.com"
  }
}