{
  "id": "W637",
  "hero": {
    "judul": {
      "id": "Perawatan Gigi dan Estetika di Cilandak",
      "en": "Dental and Aesthetic Care in Cilandak"
    },
    "sub": {
      "id": "Temukan pilihan perawatan gigi dan estetika dalam satu klinik di Jakarta Selatan.",
      "en": "Explore dental and aesthetic care options at one clinic in South Jakarta."
    },
    "cta": {
      "id": "Tanyakan Jadwal",
      "en": "Ask About Availability"
    }
  },
  "layanan": [
    {
      "nama": {
        "id": "Gigi Tiruan",
        "en": "Dentures"
      },
      "ringkas": {
        "id": "Konsultasikan pilihan pengganti gigi sesuai kondisi dan kebutuhan Anda.",
        "en": "Discuss tooth replacement options suited to your condition and needs."
      }
    },
    {
      "nama": {
        "id": "Implan Gigi",
        "en": "Dental Implants"
      },
      "ringkas": {
        "id": "Pelajari tahapan implan melalui pemeriksaan dan penjelasan dokter gigi.",
        "en": "Learn about the implant process through an examination and a dentist's guidance."
      }
    },
    {
      "nama": {
        "id": "Behel",
        "en": "Braces"
      },
      "ringkas": {
        "id": "Diskusikan kebutuhan perawatan susunan gigi sebelum menentukan pilihan behel.",
        "en": "Discuss your alignment needs before choosing a braces option."
      }
    },
    {
      "nama": {
        "id": "Veneer",
        "en": "Veneers"
      },
      "ringkas": {
        "id": "Dapatkan informasi umum mengenai veneer dan penilaian kondisi gigi terlebih dahulu.",
        "en": "Get general information about veneers, starting with an assessment of your teeth."
      }
    },
    {
      "nama": {
        "id": "Bleaching Gigi",
        "en": "Teeth Whitening"
      },
      "ringkas": {
        "id": "Tanyakan proses bleaching dan kesesuaiannya dengan kondisi gigi Anda.",
        "en": "Ask about the whitening process and whether it suits your dental condition."
      }
    }
  ],
  "fitur_khas": {
    "judul": {
      "id": "Pilih Kebutuhan Perawatan",
      "en": "Choose Your Care Needs"
    },
    "penjelasan": {
      "id": "Pilih perawatan gigi atau estetika untuk melihat informasi yang relevan dan menyiapkan pertanyaan sebelum menghubungi klinik.",
      "en": "Choose dental or aesthetic care to see relevant information and prepare questions before contacting the clinic."
    },
    "alasan_dipilih": "Klinik menyediakan layanan gigi dan estetika, sehingga pemilih kebutuhan membantu pengunjung menuju informasi yang sesuai."
  },
  "faq": [
    {
      "q": {
        "id": "Kapan klinik buka?",
        "en": "When is the clinic open?"
      },
      "a": {
        "id": "Klinik buka Senin–Sabtu pukul 10.00–18.00 WIB dan tutup pada Minggu. Hubungi klinik untuk memastikan ketersediaan jadwal.",
        "en": "The clinic is open Monday–Saturday from 10:00 AM to 6:00 PM WIB and closed on Sunday. Contact the clinic to confirm availability."
      }
    },
    {
      "q": {
        "id": "Berapa biaya perawatan?",
        "en": "How much does treatment cost?"
      },
      "a": {
        "id": "Informasi biaya belum dipublikasikan pada sumber yang kami temukan. Tanyakan kepada klinik karena biaya dapat bergantung pada pemeriksaan dan rencana perawatan.",
        "en": "Pricing was not published in the sources we found. Please ask the clinic, as costs may depend on an examination and treatment plan."
      }
    },
    {
      "q": {
        "id": "Apakah klinik menerima asuransi?",
        "en": "Does the clinic accept insurance?"
      },
      "a": {
        "id": "Klinik tercantum dalam daftar provider China Life Mei 2025. Konfirmasikan kembali cakupan, prosedur klaim, dan status kerja sama sebelum berkunjung.",
        "en": "The clinic appears on China Life's May 2025 provider list. Confirm coverage, claim procedures, and current provider status before your visit."
      }
    },
    {
      "q": {
        "id": "Apakah tersedia perawatan behel?",
        "en": "Are braces available?"
      },
      "a": {
        "id": "Ya, behel tercantum sebagai salah satu layanan. Pemeriksaan diperlukan untuk membahas kebutuhan dan rencana perawatan.",
        "en": "Yes, braces are listed among the services. An examination is needed to discuss your needs and care plan."
      }
    },
    {
      "q": {
        "id": "Apakah tersedia implan gigi?",
        "en": "Are dental implants available?"
      },
      "a": {
        "id": "Ya, implan gigi tercantum sebagai layanan. Hubungi klinik untuk menanyakan alur konsultasi dan jadwal.",
        "en": "Yes, dental implants are listed as a service. Contact the clinic to ask about consultation steps and availability."
      }
    }
  ],
  "cta": {
    "id": "Punya pertanyaan tentang perawatan? Hubungi klinik untuk menanyakan jadwal konsultasi.",
    "en": "Have questions about care? Contact the clinic to ask about consultation availability."
  },
  "pesan_wa_default": "Halo Pits Dental & Aesthetic Clinic, saya ingin menanyakan jadwal konsultasi dan informasi perawatan. Terima kasih.",
  "outreach": {
    "wa": "Halo tim Pits Dental & Aesthetic Clinic, saya Muhammad Rizqi Tri Andika dari Maxi Growth Studio. Saya melihat Pits menyediakan perawatan gigi dan estetika dalam satu klinik di Cilandak. Kami sudah menyiapkan konsep website tanpa biaya yang dapat dilihat di https://maxigrowthstudio.com/pits-aesthetic. Silakan ditinjau bila berkenan, tanpa kewajiban apa pun. Terima kasih.",
    "email_subjek": "Konsep website untuk Pits Dental & Aesthetic Clinic",
    "email_isi": "Yth. tim Pits Dental & Aesthetic Clinic,\n\nSaya Muhammad Rizqi Tri Andika dari Maxi Growth Studio. Saya melihat Pits menghadirkan perawatan gigi dan estetika dalam satu klinik di Cilandak. Kami menyiapkan konsep website tanpa biaya untuk membantu calon pasien menemukan layanan, jam buka, dan jalur konsultasi secara lebih ringkas.\n\nKonsepnya dapat ditinjau di https://maxigrowthstudio.com/pits-aesthetic. Saya juga melampirkan proposal PDF sebagai gambaran pendekatan dan ruang lingkupnya. Silakan dilihat saat nyaman; tidak ada kewajiban untuk melanjutkan.\n\nJika ada bagian yang perlu disesuaikan, saya terbuka untuk menerima arahan.\n\nSalam,\nMuhammad Rizqi Tri Andika\nMaxi Growth Studio\nWA 082141004400\ninfo@maxigrowthstudio.com"
  }
}
