{
  "id": "W1988",
  "hero": {
    "judul": {
      "id": "drg. Irvan Wira Adhitya, Sp.Perio",
      "en": "drg. Irvan Wira Adhitya, Sp.Perio"
    },
    "sub": {
      "id": "Informasi praktik di Pekanbaru dan persiapan kunjungan Anda. Konfirmasikan jadwal sebelum datang.",
      "en": "Practice information in Pekanbaru and planning for your visit. Confirm your appointment before travelling."
    },
    "cta": {
      "id": "Tanyakan kunjungan",
      "en": "Ask about a visit"
    }
  },
  "layanan": [
    {
      "nama": {
        "id": "Waktu kunjungan",
        "en": "Visit time"
      },
      "ringkas": {
        "id": "Sampaikan hari pilihan dan tanyakan jadwal dokter terbaru.",
        "en": "Share your preferred day and ask for the latest clinician schedule."
      }
    },
    {
      "nama": {
        "id": "Lokasi praktik",
        "en": "Practice location"
      },
      "ringkas": {
        "id": "Direktori mencatat lokasi di Jl. Mangga No.63B. Konfirmasikan petunjuk sebelum datang.",
        "en": "A directory lists Jl. Mangga No.63B. Confirm directions before visiting."
      }
    },
    {
      "nama": {
        "id": "Kebutuhan konsultasi",
        "en": "Consultation needs"
      },
      "ringkas": {
        "id": "Jelaskan kebutuhan Anda dan tanyakan pemeriksaan yang tersedia.",
        "en": "Describe your needs and ask what assessments are available."
      }
    },
    {
      "nama": {
        "id": "Rincian biaya",
        "en": "Fee information"
      },
      "ringkas": {
        "id": "Tanyakan biaya pemeriksaan dan rencana perawatan sebelum mengambil keputusan.",
        "en": "Ask about examination and proposed care fees before deciding."
      }
    }
  ],
  "fitur_khas": {
    "judul": {
      "id": "Siapkan pertanyaan kunjungan",
      "en": "Prepare your visit questions"
    },
    "penjelasan": {
      "id": "Pilih waktu yang Anda inginkan dan tuliskan kebutuhan konsultasi, lalu minta konfirmasi praktik.",
      "en": "Choose a preferred time, describe your consultation needs, and request confirmation from the practice."
    },
    "alasan_dipilih": "Kontak praktik tersedia di direktori, sedangkan jadwal individu dan tindakan perlu dikonfirmasi."
  },
  "faq": [
    {
      "q": {
        "id": "Di mana praktik berada?",
        "en": "Where is the practice?"
      },
      "a": {
        "id": "Direktori mencatat Jl. Mangga No.63B, Kp. Tengah, Pekanbaru. Konfirmasikan lokasi sebelum berangkat.",
        "en": "A directory lists Jl. Mangga No.63B, Kp. Tengah, Pekanbaru. Confirm the location before travelling."
      }
    },
    {
      "q": {
        "id": "Bagaimana menanyakan jadwal?",
        "en": "How can I check appointment times?"
      },
      "a": {
        "id": "Hubungi nomor yang tercantum untuk menanyakan jadwal dokter terbaru.",
        "en": "Use the listed contact number to ask for the latest clinician schedule."
      }
    },
    {
      "q": {
        "id": "Berapa biaya pemeriksaan?",
        "en": "How much is an examination?"
      },
      "a": {
        "id": "Tarif belum tersedia di sini. Mintalah rincian sesuai kebutuhan Anda.",
        "en": "Fees are not available here. Request a breakdown for your needs."
      }
    },
    {
      "q": {
        "id": "Apakah tindakan yang saya perlukan tersedia?",
        "en": "Is the care I need available?"
      },
      "a": {
        "id": "Sampaikan kebutuhan Anda agar praktik dapat mengonfirmasi tindakan dan jadwal.",
        "en": "Describe your needs so the practice can confirm care options and appointments."
      }
    },
    {
      "q": {
        "id": "Apakah asuransi diterima?",
        "en": "Is insurance accepted?"
      },
      "a": {
        "id": "Tanyakan jenis asuransi dan ketentuan pembayaran sebelum kunjungan.",
        "en": "Ask about accepted insurance and payment arrangements before visiting."
      }
    }
  ],
  "cta": {
    "id": "Tanyakan jadwal dan kebutuhan kunjungan Anda.",
    "en": "Ask about appointment times and your visit needs."
  },
  "pesan_wa_default": "Halo, saya ingin menanyakan jadwal praktik drg. Irvan Wira Adhitya. Mohon informasi lokasi, pemeriksaan, dan biaya. Terima kasih.",
  "outreach": {
    "wa": "Halo Bapak/Ibu pengelola praktik drg. Irvan Wira Adhitya. Saya Muhammad Rizqi Tri Andika dari Maxi Growth Studio. Direktori mencatat lokasi praktik di Jalan Mangga, Pekanbaru. Kami sudah membuat konsep website informasi kunjungan: https://maxigrowthstudio.com/drg-irvan. Silakan ditinjau saat berkenan. WA 082141004400; info@maxigrowthstudio.com.",
    "email_subjek": "Konsep website praktik drg. Irvan",
    "email_isi": "Halo Bapak/Ibu pengelola praktik drg. Irvan Wira Adhitya,\n\nSaya Muhammad Rizqi Tri Andika dari Maxi Growth Studio. Lokasi Jalan Mangga yang tercantum di direktori dapat menjadi dasar informasi kunjungan yang jelas. Kami sudah membuat konsep website untuk ditinjau: https://maxigrowthstudio.com/drg-irvan.\n\nProposal PDF terlampir. Silakan ditinjau saat berkenan; informasi praktik terbuka untuk koreksi.\n\nTerima kasih,\nMuhammad Rizqi Tri Andika\nMaxi Growth Studio\nWA 082141004400\ninfo@maxigrowthstudio.com"
  }
}