{
  "id": "W1703",
  "hero": {
    "judul": {
      "id": "Praktek drg. Riza Rosyida",
      "en": "Praktek drg. Riza Rosyida"
    },
    "sub": {
      "id": "Informasi perawatan gigi di Tarakan.",
      "en": "Dental care information in Tarakan."
    },
    "cta": {
      "id": "Tanyakan jadwal",
      "en": "Ask about appointments"
    }
  },
  "layanan": [
    {
      "nama": {
        "id": "Informasi janji temu",
        "en": "Appointment information"
      },
      "ringkas": {
        "id": "Tanyakan jadwal yang tersedia sebelum datang.",
        "en": "Ask about available appointment times before visiting."
      }
    },
    {
      "nama": {
        "id": "Informasi lokasi",
        "en": "Location information"
      },
      "ringkas": {
        "id": "Pastikan alamat dan petunjuk kedatangan dengan pengelola.",
        "en": "Confirm the address and directions with the practice."
      }
    },
    {
      "nama": {
        "id": "Pertanyaan biaya",
        "en": "Questions about costs"
      },
      "ringkas": {
        "id": "Minta rincian biaya sebelum menyetujui perawatan.",
        "en": "Ask for a cost breakdown before agreeing to care."
      }
    },
    {
      "nama": {
        "id": "Persiapan kunjungan",
        "en": "Visit preparation"
      },
      "ringkas": {
        "id": "Tanyakan informasi dan dokumen yang diperlukan saat kunjungan.",
        "en": "Ask which information and documents to bring."
      }
    }
  ],
  "fitur_khas": {
    "judul": {
      "id": "Susun pertanyaan sebelum berkunjung",
      "en": "Plan your visit"
    },
    "penjelasan": {
      "id": "Pilih kebutuhan informasi untuk menyusun pesan kepada praktik. Jadwal dan ketersediaan tindakan perlu dikonfirmasi.",
      "en": "Explore appointment information and prepare questions for the clinic."
    },
    "alasan_dipilih": "Kontak dan lokasi praktik tercantum pada sumber publik."
  },
  "faq": [
    {
      "q": {
        "id": "Bagaimana membuat janji?",
        "en": "How do I book?"
      },
      "a": {
        "id": "Hubungi kontak klinik untuk menanyakan jadwal.",
        "en": "Contact the clinic to ask about appointments."
      }
    },
    {
      "q": {
        "id": "Berapa biaya perawatan?",
        "en": "How much does treatment cost?"
      },
      "a": {
        "id": "Minta rincian biaya kepada klinik sebelum menyetujui tindakan.",
        "en": "Ask the clinic for a cost breakdown before agreeing to treatment."
      }
    },
    {
      "q": {
        "id": "Apakah menerima asuransi?",
        "en": "Is insurance accepted?"
      },
      "a": {
        "id": "Informasi asuransi belum terkonfirmasi. Tanyakan langsung kepada klinik.",
        "en": "Insurance information is unconfirmed. Please ask the clinic."
      }
    },
    {
      "q": {
        "id": "Apa yang perlu disiapkan?",
        "en": "What should I bring?"
      },
      "a": {
        "id": "Tanyakan dokumen dan informasi yang diperlukan saat membuat janji.",
        "en": "Ask which documents and information are needed when booking."
      }
    },
    {
      "q": {
        "id": "Apakah jadwal dapat berubah?",
        "en": "Can appointment times change?"
      },
      "a": {
        "id": "Konfirmasi jadwal dengan klinik sebelum berkunjung.",
        "en": "Confirm your appointment with the clinic before visiting."
      }
    }
  ],
  "cta": {
    "id": "Hubungi klinik",
    "en": "Contact the clinic"
  },
  "pesan_wa_default": "Halo, saya ingin menanyakan jadwal konsultasi dan informasi biaya perawatan.",
  "outreach": {
    "wa": "Selamat pagi, Bapak/Ibu pengelola Praktek drg. Riza Rosyida. Saya Muhammad Rizqi Tri Andika dari Maxi Growth Studio. Kami melihat informasi praktik Anda di Tarakan. Kami sudah menyiapkan konsep website untuk ditinjau di https://maxigrowthstudio.com/drg-riza. Bila berkenan, silakan melihat susunan informasi kunjungannya. Terima kasih.",
    "email_subjek": "Konsep website Praktek drg. Riza Rosyida",
    "email_isi": "Yth. Pengelola Praktek drg. Riza Rosyida,\n\nSaya Muhammad Rizqi Tri Andika dari Maxi Growth Studio. Kami menyiapkan konsep website berdasarkan informasi praktik Anda di Tarakan: https://maxigrowthstudio.com/drg-riza.\n\nKonsep ini menyusun informasi kunjungan agar mudah ditinjau. Draf email ini disiapkan untuk digunakan bersama proposal PDF terlampir; lampiran perlu disiapkan sebelum pengiriman. Silakan meninjau dan memberi koreksi pada informasi klinik.\n\nMuhammad Rizqi Tri Andika\nMaxi Growth Studio\n082141004400\ninfo@maxigrowthstudio.com"
  }
}