{
  "id": "W1181",
  "hero": {
    "judul": {
      "id": "eldental Purwokerto Kids & Family Dental Care",
      "en": "eldental Purwokerto Kids & Family Dental Care"
    },
    "sub": {
      "id": "Informasi perawatan gigi di Purwokerto",
      "en": "Dental care information in Purwokerto"
    },
    "cta": {
      "id": "Tanyakan jadwal",
      "en": "Ask about appointments"
    }
  },
  "layanan": [
    {
      "nama": {
        "id": "Perawatan gigi umum",
        "en": "General dental care"
      },
      "ringkas": {
        "id": "Tanyakan kesesuaian tindakan kepada tim klinik.",
        "en": "Ask the clinic whether this treatment is appropriate."
      }
    },
    {
      "nama": {
        "id": "Perawatan gigi anak",
        "en": "Children's dental care"
      },
      "ringkas": {
        "id": "Tanyakan kesesuaian tindakan kepada tim klinik.",
        "en": "Ask the clinic whether this treatment is appropriate."
      }
    },
    {
      "nama": {
        "id": "Ortodonti",
        "en": "Orthodontics"
      },
      "ringkas": {
        "id": "Tanyakan kesesuaian tindakan kepada tim klinik.",
        "en": "Ask the clinic whether this treatment is appropriate."
      }
    },
    {
      "nama": {
        "id": "Perawatan saluran akar",
        "en": "Root canal treatment"
      },
      "ringkas": {
        "id": "Tanyakan kesesuaian tindakan kepada tim klinik.",
        "en": "Ask the clinic whether this treatment is appropriate."
      }
    }
  ],
  "fitur_khas": {
    "judul": {
      "id": "Persiapkan kunjungan",
      "en": "Plan your visit"
    },
    "penjelasan": {
      "id": "Catat keluhan dan konfirmasikan jadwal melalui WhatsApp.",
      "en": "Note your concerns and confirm appointment availability via WhatsApp."
    },
    "alasan_dipilih": "Membantu pasien mengonfirmasi informasi sebelum berkunjung."
  },
  "faq": [
    {
      "q": {
        "id": "Bagaimana membuat janji?",
        "en": "How do I make an appointment?"
      },
      "a": {
        "id": "Tanyakan waktu yang tersedia melalui nomor WhatsApp tercantum.",
        "en": "Ask about availability using the listed WhatsApp number."
      }
    },
    {
      "q": {
        "id": "Berapa biaya perawatan?",
        "en": "How much does treatment cost?"
      },
      "a": {
        "id": "Daftar biaya belum tersedia di sini. Mintalah estimasi kepada klinik.",
        "en": "Prices are not available here. Ask the clinic for an estimate."
      }
    },
    {
      "q": {
        "id": "Kapan dokter praktik?",
        "en": "When is the dentist available?"
      },
      "a": {
        "id": "Konfirmasikan jadwal terbaru kepada tim klinik.",
        "en": "Confirm the current schedule with the clinic."
      }
    },
    {
      "q": {
        "id": "Apakah menerima asuransi?",
        "en": "Is insurance accepted?"
      },
      "a": {
        "id": "Situs klinik menyebut beberapa mitra asuransi. Konfirmasikan polis dan prosedurnya kepada admin; respons situs Juli2026 menyatakan BPJS belum dilayani.",
        "en": "The clinic lists several insurance partners. Confirm your policy and requirements with the clinic; a July2026 website response states BPJS is not accepted."
      }
    },
    {
      "q": {
        "id": "Apa yang perlu dibawa?",
        "en": "What should I bring?"
      },
      "a": {
        "id": "Tanyakan dokumen dan persiapan yang diperlukan kepada klinik.",
        "en": "Ask the clinic which documents and preparation are needed."
      }
    }
  ],
  "cta": {
    "id": "Hubungi klinik",
    "en": "Contact the clinic"
  },
  "pesan_wa_default": "Halo, saya ingin menanyakan jadwal pemeriksaan gigi. Mohon informasi waktu yang tersedia.",
  "outreach": {
    "wa": "Yth. pengelola eldental Purwokerto Kids & Family Dental Care, saya Muhammad Rizqi Tri Andika dari Maxi Growth Studio. Kami melihat informasi klinik Anda di Purwokerto. Kami mengusulkan konsep website dengan alamat pratinjau yang direncanakan https://maxigrowthstudio.com/eldental-purwokerto untuk ditinjau. Bila berkenan, kami dapat membahas kebutuhan informasi klinik. Terima kasih.",
    "email_subjek": "Konsep website eldental Purwokerto Kids & Family Dental Care",
    "email_isi": "Yth. pengelola eldental Purwokerto Kids & Family Dental Care,\n\nSaya Muhammad Rizqi Tri Andika dari Maxi Growth Studio. Kami mengusulkan konsep website eldental Purwokerto Kids & Family Dental Care di Purwokerto. Alamat pratinjau yang direncanakan: https://maxigrowthstudio.com/eldental-purwokerto. Proposal PDF disiapkan sebagai lampiran. Bila berkenan, kami dapat membahas kebutuhan informasi klinik.\n\nMuhammad Rizqi Tri Andika\n082141004400\ninfo@maxigrowthstudio.com"
  }
}