{
  "id": "W2102",
  "hero": {
    "judul": {
      "id": "Sycamore Dental Studio",
      "en": "Sycamore Dental Studio"
    },
    "sub": {
      "id": "Siapkan pertanyaan sebelum kunjungan. Konfirmasikan alamat, jadwal dan kebutuhan pemeriksaan kepada klinik.",
      "en": "Prepare your questions before visiting. Confirm the location, appointment time and examination needs with the clinic."
    },
    "cta": {
      "id": "Tanyakan kunjungan",
      "en": "Ask about a visit"
    }
  },
  "layanan": [
    {
      "nama": {
        "id": "Tanyakan pemeriksaan",
        "en": "Ask about examinations"
      },
      "ringkas": {
        "id": "Sampaikan keluhan dan tanyakan alur pemeriksaan yang tersedia.",
        "en": "Describe your concern and ask which examinations are available."
      }
    },
    {
      "nama": {
        "id": "Tanyakan jadwal",
        "en": "Ask about appointments"
      },
      "ringkas": {
        "id": "Ajukan hari pilihan dan tunggu konfirmasi klinik sebelum berangkat.",
        "en": "Share your preferred day and wait for confirmation before travelling."
      }
    },
    {
      "nama": {
        "id": "Tanyakan biaya",
        "en": "Ask about costs"
      },
      "ringkas": {
        "id": "Minta rincian biaya pemeriksaan dan tindakan yang disarankan.",
        "en": "Request a breakdown of examination and proposed treatment costs."
      }
    },
    {
      "nama": {
        "id": "Tanyakan persiapan",
        "en": "Ask how to prepare"
      },
      "ringkas": {
        "id": "Tanyakan dokumen dan informasi riwayat kesehatan yang perlu dibawa.",
        "en": "Ask which documents and medical history details to bring."
      }
    }
  ],
  "fitur_khas": {
    "judul": {
      "id": "Rencanakan hari kunjungan di Balikpapan",
      "en": "Plan your visiting day in Balikpapan"
    },
    "penjelasan": {
      "id": "Susun pesan berisi hari pilihan, pertanyaan biaya dan titik lokasi Balikpapan Permai. Jam ditampilkan dalam WITA; permintaan kunjungan menunggu konfirmasi klinik.",
      "en": "Draft a message with your preferred day, fee questions and the Balikpapan Permai location. Hours use WITA; visit requests require clinic confirmation."
    },
    "alasan_dipilih": "Jadwal direktori berbeda antarhari dan mencantumkan Minggu buka serta Sabtu tutup; pemilihan hari membantu konfirmasi sebelum berangkat."
  },
  "faq": [
    {
      "q": {
        "id": "Di mana alamat yang tercantum?",
        "en": "What is the listed address?"
      },
      "a": {
        "id": "Lokasi yang tercantum: Komp. Balikpapan Permai, Blok C2 No.609, Damai, Kecamatan Balikpapan Kota, Kota Balikpapan, Kalimantan Timur 76114. Konfirmasikan titik lokasi sebelum datang.",
        "en": "Listed location: Komp. Balikpapan Permai, Blok C2 No.609, Damai, Kecamatan Balikpapan Kota, Kota Balikpapan, Kalimantan Timur 76114. Confirm the location before visiting."
      }
    },
    {
      "q": {
        "id": "Kapan klinik buka?",
        "en": "When is the clinic open?"
      },
      "a": {
        "id": "Direktori mencantumkan Senin, Selasa, Kamis dan Minggu 14.00–21.00; Rabu 10.00–16.00; Jumat 10.00–15.00 WITA; Sabtu tutup. Konfirmasikan jadwal terkini.",
        "en": "Directories list Monday, Tuesday, Thursday and Sunday 2–9 pm; Wednesday 10 am–4 pm; Friday 10 am–3 pm WITA; Saturday closed. Confirm current hours."
      }
    },
    {
      "q": {
        "id": "Berapa biaya pemeriksaan?",
        "en": "How much is an examination?"
      },
      "a": {
        "id": "Harga belum tersedia. Mintalah rincian biaya kepada klinik.",
        "en": "Prices are not available. Request a cost breakdown from the clinic."
      }
    },
    {
      "q": {
        "id": "Apakah tindakan yang saya butuhkan tersedia?",
        "en": "Is the treatment I need available?"
      },
      "a": {
        "id": "Daftar layanan belum terkonfirmasi. Sampaikan kebutuhan Anda dan tanyakan pilihan pemeriksaannya.",
        "en": "The service list is unconfirmed. Describe your needs and ask about examination options."
      }
    },
    {
      "q": {
        "id": "Apakah dapat memakai asuransi?",
        "en": "Can I use insurance?"
      },
      "a": {
        "id": "Kerja sama asuransi belum terkonfirmasi. Tanyakan penjamin dan dokumen yang diperlukan.",
        "en": "Insurance arrangements are unconfirmed. Ask about insurers and required documents."
      }
    }
  ],
  "cta": {
    "id": "Konfirmasikan kebutuhan kunjungan",
    "en": "Confirm your visit requirements"
  },
  "pesan_wa_default": "Halo Sycamore Dental Studio, saya ingin menanyakan jadwal, alamat dan biaya pemeriksaan. Apakah dapat membuat janji kunjungan? Terima kasih.",
  "outreach": {
    "wa": "Halo Manajemen Sycamore Dental Studio, saya Muhammad Rizqi Tri Andika dari Maxi Growth Studio. Kami menyiapkan konsep website untuk informasi lokasi Balikpapan Permai, Blok C2 dan pertanyaan pra-kunjungan: https://maxigrowthstudio.com/sycamore-studio. Informasi jadwal dan layanan dapat disesuaikan berdasarkan data manajemen. Jika berkenan, silakan ditinjau. Terima kasih. WA 082141004400 | info@maxigrowthstudio.com",
    "email_subjek": "Konsep website Sycamore Dental Studio",
    "email_isi": "Yth. Manajemen Sycamore Dental Studio,\n\nSaya Muhammad Rizqi Tri Andika dari Maxi Growth Studio. Kami menyiapkan konsep website dengan informasi lokasi Balikpapan Permai, Blok C2 dan penyusun pertanyaan pra-kunjungan. Rancangan ini membantu pasien menanyakan jadwal, biaya dan persiapan kepada klinik.\n\nKonsep untuk ditinjau: https://maxigrowthstudio.com/sycamore-studio. Proposal PDF terlampir sebagai bahan pertimbangan. Data layanan dan jadwal dapat disesuaikan dengan informasi manajemen.\n\nTerima kasih,\nMuhammad Rizqi Tri Andika\nMaxi Growth Studio\nWA 082141004400\ninfo@maxigrowthstudio.com"
  }
}