{
  "id": "W1909",
  "hero": {
    "judul": {
      "id": "Drg.Qiptiawati",
      "en": "Drg.Qiptiawati"
    },
    "sub": {
      "id": "Siapkan pertanyaan sebelum kunjungan. Konfirmasikan alamat, jadwal dan kebutuhan pemeriksaan kepada klinik.",
      "en": "Prepare your questions before visiting. Confirm the location, appointment time and examination needs with the clinic."
    },
    "cta": {
      "id": "Tanyakan kunjungan",
      "en": "Ask about a visit"
    }
  },
  "layanan": [
    {
      "nama": {
        "id": "Tanyakan scaling",
        "en": "Ask about cleaning"
      },
      "ringkas": {
        "id": "Tanyakan ketersediaan, pemeriksaan awal dan rincian biaya kepada klinik.",
        "en": "Ask the clinic about availability, initial assessment and costs."
      }
    },
    {
      "nama": {
        "id": "Tanyakan tambal gigi",
        "en": "Ask about fillings"
      },
      "ringkas": {
        "id": "Tanyakan ketersediaan, pemeriksaan awal dan rincian biaya kepada klinik.",
        "en": "Ask the clinic about availability, initial assessment and costs."
      }
    },
    {
      "nama": {
        "id": "Tanyakan kawat gigi",
        "en": "Ask about braces"
      },
      "ringkas": {
        "id": "Tanyakan ketersediaan, pemeriksaan awal dan rincian biaya kepada klinik.",
        "en": "Ask the clinic about availability, initial assessment and costs."
      }
    },
    {
      "nama": {
        "id": "Tanyakan veneer",
        "en": "Ask about veneers"
      },
      "ringkas": {
        "id": "Tanyakan ketersediaan, pemeriksaan awal dan rincian biaya kepada klinik.",
        "en": "Ask the clinic about availability, initial assessment and costs."
      }
    }
  ],
  "fitur_khas": {
    "judul": {
      "id": "Susun pertanyaan Anda",
      "en": "Build your question list"
    },
    "penjelasan": {
      "id": "Pilih topik dan hari pilihan untuk menyusun pesan pra-kunjungan. Formulir ini membantu bertanya; janji temu memerlukan konfirmasi klinik.",
      "en": "Select topics and a preferred day to prepare a message. This form helps you ask questions; appointments require confirmation."
    },
    "alasan_dipilih": "Informasi publik terbatas; fitur berfokus pada konfirmasi tanpa mengarang layanan atau jadwal."
  },
  "faq": [
    {
      "q": {
        "id": "Di mana alamat yang tercantum?",
        "en": "What is the listed address?"
      },
      "a": {
        "id": "Lokasi yang tercantum: Jl. Cinere Raya No.120 A, Cinere, Kec. Cinere, Kota Depok, Jawa Barat 16514. Konfirmasikan titik lokasi sebelum datang.",
        "en": "Listed location: Jl. Cinere Raya No.120 A, Cinere, Kec. Cinere, Kota Depok, Jawa Barat 16514. Confirm the location before visiting."
      }
    },
    {
      "q": {
        "id": "Kapan klinik buka?",
        "en": "When is the clinic open?"
      },
      "a": {
        "id": "Dua direktori mencantumkan Senin-Sabtu10.00-19.00 WIB, Minggu tutup. Konfirmasikan sebelum datang.",
        "en": "Two directories list Monday to Saturday,10 am to7 pm WIB; Sunday closed. Confirm before visiting."
      }
    },
    {
      "q": {
        "id": "Berapa biaya pemeriksaan?",
        "en": "How much is an examination?"
      },
      "a": {
        "id": "Harga belum tersedia. Mintalah rincian biaya kepada klinik.",
        "en": "Prices are not available. Request a cost breakdown from the clinic."
      }
    },
    {
      "q": {
        "id": "Apakah tindakan yang saya butuhkan tersedia?",
        "en": "Is the treatment I need available?"
      },
      "a": {
        "id": "Direktori menyebut scaling, tambal, kawat gigi dan veneer. Tanyakan ketersediaan serta pilihan setelah pemeriksaan.",
        "en": "A directory lists cleaning, fillings, braces and veneers. Confirm availability and discuss options after an assessment."
      }
    },
    {
      "q": {
        "id": "Apakah dapat memakai asuransi?",
        "en": "Can I use insurance?"
      },
      "a": {
        "id": "Kerja sama asuransi belum terkonfirmasi. Tanyakan penjamin dan dokumen yang diperlukan.",
        "en": "Insurance arrangements are unconfirmed. Ask about insurers and required documents."
      }
    }
  ],
  "cta": {
    "id": "Konfirmasikan kebutuhan kunjungan",
    "en": "Confirm your visit requirements"
  },
  "pesan_wa_default": "Halo Drg.Qiptiawati, saya ingin menanyakan jadwal, alamat dan biaya pemeriksaan. Apakah dapat membuat janji kunjungan? Terima kasih.",
  "outreach": {
    "wa": "Halo Manajemen Drg.Qiptiawati, saya Muhammad Rizqi Tri Andika dari Maxi Growth Studio. Kami menyiapkan konsep website untuk informasi lokasi Jalan Cinere Raya120A dan pertanyaan pra-kunjungan: https://maxigrowthstudio.com/drg-qiptiawati. Informasi jadwal dan layanan dapat disesuaikan berdasarkan data manajemen. Jika berkenan, silakan ditinjau. Terima kasih. WA 082141004400 | info@maxigrowthstudio.com",
    "email_subjek": "Konsep website Drg.Qiptiawati",
    "email_isi": "Yth. Manajemen Drg.Qiptiawati,\n\nSaya Muhammad Rizqi Tri Andika dari Maxi Growth Studio. Kami menyiapkan konsep website dengan informasi lokasi Jalan Cinere Raya120A dan penyusun pertanyaan pra-kunjungan. Rancangan ini membantu pasien menanyakan jadwal, biaya dan persiapan kepada klinik.\n\nKonsep untuk ditinjau: https://maxigrowthstudio.com/drg-qiptiawati. Proposal PDF terlampir sebagai bahan pertimbangan. Data layanan dan jadwal dapat disesuaikan dengan informasi manajemen.\n\nTerima kasih,\nMuhammad Rizqi Tri Andika\nMaxi Growth Studio\nWA 082141004400\ninfo@maxigrowthstudio.com"
  }
}