{
  "id": "W1533",
  "hero": {
    "judul": {
      "id": "Informasi Perawatan Gigi Sunrise Dental Banyuwangi",
      "en": "Dental Care at Sunrise Dental Banyuwangi"
    },
    "sub": {
      "id": "Kenali layanan gigi, lokasi di Genteng, dan jadwal dokter yang tercantum sebelum membuat janji.",
      "en": "Explore dental services, the Genteng location, and listed clinician schedules before booking."
    },
    "cta": {
      "id": "Tanyakan Jadwal Dokter",
      "en": "Ask About Clinician Hours"
    }
  },
  "layanan": [
    {
      "nama": {
        "id": "Tambal Gigi",
        "en": "Dental Fillings"
      },
      "ringkas": {
        "id": "Perawatan untuk gigi berlubang dapat didiskusikan setelah pemeriksaan dokter.",
        "en": "Discuss treatment for cavities following a dental examination."
      }
    },
    {
      "nama": {
        "id": "Pembersihan Karang Gigi",
        "en": "Teeth Cleaning"
      },
      "ringkas": {
        "id": "Tanyakan jadwal pembersihan karang gigi dan pemeriksaan pendukung.",
        "en": "Ask about teeth cleaning appointments and related assessments."
      }
    },
    {
      "nama": {
        "id": "Perawatan Saluran Akar",
        "en": "Root Canal Treatment"
      },
      "ringkas": {
        "id": "Dokter dapat menilai kebutuhan perawatan saluran akar berdasarkan kondisi gigi.",
        "en": "A dentist can assess whether root canal treatment may be appropriate."
      }
    },
    {
      "nama": {
        "id": "Perawatan Gigi Anak",
        "en": "Children's Dental Care"
      },
      "ringkas": {
        "id": "Tanyakan jadwal pemeriksaan anak dan persiapan sebelum kunjungan.",
        "en": "Ask about children's appointments and visit preparation."
      }
    },
    {
      "nama": {
        "id": "Gigi Tiruan",
        "en": "Dentures"
      },
      "ringkas": {
        "id": "Diskusikan pilihan gigi tiruan lepasan atau cekat sesuai hasil pemeriksaan.",
        "en": "Discuss removable or fixed dentures based on a dental assessment."
      }
    }
  ],
  "fitur_khas": {
    "judul": {
      "id": "Panduan Jadwal Dokter",
      "en": "Clinician Schedule Guide"
    },
    "penjelasan": {
      "id": "Lihat jadwal yang tercantum untuk I Putu Swastikawan dan Pintan Qorina. Jadwal Sabtu menyesuaikan; konfirmasikan sebelum berkunjung.",
      "en": "Review listed hours for I Putu Swastikawan and Pintan Qorina. Saturday schedules vary; please confirm before visiting."
    },
    "alasan_dipilih": "Website klinik mencantumkan jadwal berbeda untuk dua dokter dan menyebut jadwal Sabtu menyesuaikan."
  },
  "faq": [
    {
      "q": {
        "id": "Di mana lokasi Sunrise Dental Banyuwangi?",
        "en": "Where is Sunrise Dental Banyuwangi located?"
      },
      "a": {
        "id": "Alamat yang tercantum adalah Jl. KH. Wahid Hasyim No.125, Genteng Kulon, Banyuwangi.",
        "en": "The listed address is Jl. KH. Wahid Hasyim No.125, Genteng Kulon, Banyuwangi."
      }
    },
    {
      "q": {
        "id": "Bagaimana mengetahui jadwal dokter?",
        "en": "How can I check clinician hours?"
      },
      "a": {
        "id": "Website memuat jadwal dua dokter pada hari kerja dan menyebut jadwal Sabtu menyesuaikan. Konfirmasikan jadwal terbaru sebelum datang.",
        "en": "The website lists weekday hours for two clinicians and notes that Saturday schedules vary. Please confirm current availability."
      }
    },
    {
      "q": {
        "id": "Apakah tersedia perawatan gigi anak?",
        "en": "Is children's dental care available?"
      },
      "a": {
        "id": "Perawatan gigi anak tercantum pada halaman layanan klinik. Tanyakan jadwal pemeriksaannya.",
        "en": "Children's dental care is listed on the clinic website. Please ask about appointment times."
      }
    },
    {
      "q": {
        "id": "Berapa biaya tambal atau scaling?",
        "en": "How much do fillings or cleaning cost?"
      },
      "a": {
        "id": "Daftar harga resmi belum ditemukan. Tanyakan rincian biaya berdasarkan kebutuhan pemeriksaan.",
        "en": "An official price list was not found. Please request a quote based on your dental needs."
      }
    },
    {
      "q": {
        "id": "Apakah menerima asuransi?",
        "en": "Does the clinic accept insurance?"
      },
      "a": {
        "id": "Informasi kerja sama asuransi belum terverifikasi. Silakan konfirmasi kepada klinik.",
        "en": "Insurance arrangements have not been verified. Please check with the clinic."
      }
    }
  ],
  "cta": {
    "id": "Hubungi Sunrise Dental Banyuwangi untuk memastikan jadwal dokter dan informasi perawatan.",
    "en": "Contact Sunrise Dental Banyuwangi to confirm clinician hours and treatment information."
  },
  "pesan_wa_default": "Halo Sunrise Dental Banyuwangi, saya ingin menanyakan jadwal dokter dan layanan pemeriksaan gigi. Mohon bantuannya.",
  "outreach": {
    "wa": "Halo Bapak/Ibu pengelola Sunrise Dental Banyuwangi, saya Muhammad Rizqi Tri Andika dari Maxi Growth Studio. Kami melihat website klinik memuat jadwal berbeda untuk beberapa dokter. Kami telah menyiapkan konsep website dengan panduan jadwal dokter untuk ditinjau di https://maxigrowthstudio.com/sunrise-banyuwangi. Bila berkenan, silakan dilihat. Terima kasih. WA saya 082141004400.",
    "email_subjek": "Konsep website Sunrise Dental Banyuwangi",
    "email_isi": "Yth. Pengelola Sunrise Dental Banyuwangi,\n\nPerkenalkan, saya Muhammad Rizqi Tri Andika dari Maxi Growth Studio. Kami melihat informasi layanan dan jadwal dokter pada website Sunrise Dental Banyuwangi di Genteng.\n\nKami telah menyiapkan konsep website yang membantu pasien memilih topik perawatan dan memahami jadwal dokter. Konsep dapat ditinjau di https://maxigrowthstudio.com/sunrise-banyuwangi. Proposal PDF terlampir sebagai bahan pertimbangan.\n\nApabila berkenan, kami terbuka menerima masukan tanpa kewajiban untuk menindaklanjuti.\n\nSalam,\nMuhammad Rizqi Tri Andika\nMaxi Growth Studio\nWA 082141004400\ninfo@maxigrowthstudio.com"
  }
}